num_soura,num_aya,aya,name_soura
38,79,قال رب فأنظرني إلى يوم يبعثون,ص
38,80,قال فإنك من المنظرين,ص
38,81,إلى يوم الوقت المعلوم,ص
38,82,قال فبعزتك لأغوينهم أجمعين,ص
38,83,إلا عبادك منهم المخلصين,ص
38,84,قال فالحق والحق أقول,ص
38,85,لأملأن جهنم منك وممن تبعك منهم أجمعين,ص
38,86,قل ما أسألكم عليه من أجر وما أنا من المتكلفين,ص
38,87,إن هو إلا ذكر للعالمين,ص
38,88,ولتعلمن نبأه بعد حين,ص
39,1,تنزيل الكتاب من الله العزيز الحكيم,الزمر
39,2,إنا أنزلنا إليك الكتاب بالحق فاعبد الله مخلصا له الدين,الزمر
39,3,ألا لله الدين الخالص ۚ والذين اتخذوا من دونه أولياء ما نعبدهم إلا ليقربونا إلى الله زلفى إن الله يحكم بينهم في ما هم فيه يختلفون ۗ إن الله لا يهدي من هو كاذب كفار,الزمر
39,4,لو أراد الله أن يتخذ ولدا لاصطفى مما يخلق ما يشاء ۚ سبحانه ۖ هو الله الواحد القهار,الزمر
39,5,خلق السماوات والأرض بالحق ۖ يكور الليل على النهار ويكور النهار على الليل ۖ وسخر الشمس والقمر ۖ كل يجري لأجل مسمى ۗ ألا هو العزيز الغفار,الزمر
39,6,خلقكم من نفس واحدة ثم جعل منها زوجها وأنزل لكم من الأنعام ثمانية أزواج ۚ يخلقكم في بطون أمهاتكم خلقا من بعد خلق في ظلمات ثلاث ۚ ذلكم الله ربكم له الملك ۖ لا إله إلا هو ۖ فأنى تصرفون,الزمر
39,7,إن تكفروا فإن الله غني عنكم ۖ ولا يرضى لعباده الكفر ۖ وإن تشكروا يرضه لكم ۗ ولا تزر وازرة وزر أخرى ۗ ثم إلى ربكم مرجعكم فينبئكم بما كنتم تعملون ۚ إنه عليم بذات الصدور,الزمر
39,8,وإذا مس الإنسان ضر دعا ربه منيبا إليه ثم إذا خوله نعمة منه نسي ما كان يدعو إليه من قبل وجعل لله أندادا ليضل عن سبيله ۚ قل تمتع بكفرك قليلا ۖ إنك من أصحاب النار,الزمر
39,9,أمن هو قانت آناء الليل ساجدا وقائما يحذر الآخرة ويرجو رحمة ربه ۗ قل هل يستوي الذين يعلمون والذين لا يعلمون ۗ إنما يتذكر أولو الألباب,الزمر
39,10,قل يا عباد الذين آمنوا اتقوا ربكم ۚ للذين أحسنوا في هذه الدنيا حسنة ۗ وأرض الله واسعة ۗ إنما يوفى الصابرون أجرهم بغير حساب,الزمر
39,11,قل إني أمرت أن أعبد الله مخلصا له الدين,الزمر
39,12,وأمرت لأن أكون أول المسلمين,الزمر
39,13,قل إني أخاف إن عصيت ربي عذاب يوم عظيم,الزمر
39,14,قل الله أعبد مخلصا له ديني,الزمر
39,15,فاعبدوا ما شئتم من دونه ۗ قل إن الخاسرين الذين خسروا أنفسهم وأهليهم يوم القيامة ۗ ألا ذلك هو الخسران المبين,الزمر
39,16,لهم من فوقهم ظلل من النار ومن تحتهم ظلل ۚ ذلك يخوف الله به عباده ۚ يا عباد فاتقون,الزمر
39,17,والذين اجتنبوا الطاغوت أن يعبدوها وأنابوا إلى الله لهم البشرى ۚ فبشر عباد,الزمر
39,18,الذين يستمعون القول فيتبعون أحسنه ۚ أولئك الذين هداهم الله ۖ وأولئك هم أولو الألباب,الزمر
39,19,أفمن حق عليه كلمة العذاب أفأنت تنقذ من في النار,الزمر
39,20,لكن الذين اتقوا ربهم لهم غرف من فوقها غرف مبنية تجري من تحتها الأنهار ۖ وعد الله ۖ لا يخلف الله الميعاد,الزمر
39,21,ألم تر أن الله أنزل من السماء ماء فسلكه ينابيع في الأرض ثم يخرج به زرعا مختلفا ألوانه ثم يهيج فتراه مصفرا ثم يجعله حطاما ۚ إن في ذلك لذكرى لأولي الألباب,الزمر
39,22,أفمن شرح الله صدره للإسلام فهو على نور من ربه ۚ فويل للقاسية قلوبهم من ذكر الله ۚ أولئك في ضلال مبين,الزمر
39,23,الله نزل أحسن الحديث كتابا متشابها مثاني تقشعر منه جلود الذين يخشون ربهم ثم تلين جلودهم وقلوبهم إلى ذكر الله ۚ ذلك هدى الله يهدي به من يشاء ۚ ومن يضلل الله فما له من هاد,الزمر
39,24,أفمن يتقي بوجهه سوء العذاب يوم القيامة ۚ وقيل للظالمين ذوقوا ما كنتم تكسبون,الزمر
39,25,كذب الذين من قبلهم فأتاهم العذاب من حيث لا يشعرون,الزمر
39,26,فأذاقهم الله الخزي في الحياة الدنيا ۖ ولعذاب الآخرة أكبر ۚ لو كانوا يعلمون,الزمر
39,27,ولقد ضربنا للناس في هذا القرآن من كل مثل لعلهم يتذكرون,الزمر
39,28,قرآنا عربيا غير ذي عوج لعلهم يتقون,الزمر
39,29,ضرب الله مثلا رجلا فيه شركاء متشاكسون ورجلا سلما لرجل هل يستويان مثلا ۚ الحمد لله ۚ بل أكثرهم لا يعلمون,الزمر
39,30,إنك ميت وإنهم ميتون,الزمر
39,31,ثم إنكم يوم القيامة عند ربكم تختصمون,الزمر
39,32,فمن أظلم ممن كذب على الله وكذب بالصدق إذ جاءه ۚ أليس في جهنم مثوى للكافرين,الزمر
39,33,والذي جاء بالصدق وصدق به ۙ أولئك هم المتقون,الزمر
39,34,لهم ما يشاءون عند ربهم ۚ ذلك جزاء المحسنين,الزمر
39,35,ليكفر الله عنهم أسوأ الذي عملوا ويجزيهم أجرهم بأحسن الذي كانوا يعملون,الزمر
39,36,أليس الله بكاف عبده ۖ ويخوفونك بالذين من دونه ۚ ومن يضلل الله فما له من هاد,الزمر
39,37,ومن يهد الله فما له من مضل ۗ أليس الله بعزيز ذي انتقام,الزمر
39,38,ولئن سألتهم من خلق السماوات والأرض ليقولن الله ۚ قل أفرأيتم ما تدعون من دون الله إن أرادني الله بضر هل هن كاشفات ضره أو أرادني برحمة هل هن ممسكات رحمته ۚ قل حسبي الله ۖ عليه يتوكل المتوكلون,الزمر
39,39,قل يا قوم اعملوا على مكانتكم إني عامل ۖ فسوف تعلمون,الزمر
39,40,من يأتيه عذاب يخزيه ويحل عليه عذاب مقيم,الزمر
39,41,إنا أنزلنا عليك الكتاب للناس بالحق ۖ فمن اهتدى فلنفسه ۖ ومن ضل فإنما يضل عليها ۖ وما أنت عليهم بوكيل,الزمر
39,42,الله يتوفى الأنفس حين موتها والتي لم تمت في منامها ۖ فيمسك التي قضى عليها الموت ويرسل الأخرى إلى أجل مسمى ۚ إن في ذلك لآيات لقوم يتفكرون,الزمر
39,43,أم اتخذوا من دون الله شفعاء ۚ قل أولو كانوا لا يملكون شيئا ولا يعقلون,الزمر
39,44,قل لله الشفاعة جميعا ۖ له ملك السماوات والأرض ۖ ثم إليه ترجعون,الزمر
39,45,وإذا ذكر الله وحده اشمأزت قلوب الذين لا يؤمنون بالآخرة ۖ وإذا ذكر الذين من دونه إذا هم يستبشرون,الزمر
39,46,قل اللهم فاطر السماوات والأرض عالم الغيب والشهادة أنت تحكم بين عبادك في ما كانوا فيه يختلفون,الزمر
39,47,ولو أن للذين ظلموا ما في الأرض جميعا ومثله معه لافتدوا به من سوء العذاب يوم القيامة ۚ وبدا لهم من الله ما لم يكونوا يحتسبون,الزمر
39,48,وبدا لهم سيئات ما كسبوا وحاق بهم ما كانوا به يستهزئون,الزمر
39,49,فإذا مس الإنسان ضر دعانا ثم إذا خولناه نعمة منا قال إنما أوتيته على علم ۚ بل هي فتنة ولكن أكثرهم لا يعلمون,الزمر
39,50,قد قالها الذين من قبلهم فما أغنى عنهم ما كانوا يكسبون,الزمر
39,51,فأصابهم سيئات ما كسبوا ۚ والذين ظلموا من هؤلاء سيصيبهم سيئات ما كسبوا وما هم بمعجزين,الزمر
39,52,أولم يعلموا أن الله يبسط الرزق لمن يشاء ويقدر ۚ إن في ذلك لآيات لقوم يؤمنون,الزمر
39,53,قل يا عبادي الذين أسرفوا على أنفسهم لا تقنطوا من رحمة الله ۚ إن الله يغفر الذنوب جميعا ۚ إنه هو الغفور الرحيم,الزمر
39,54,وأنيبوا إلى ربكم وأسلموا له من قبل أن يأتيكم العذاب ثم لا تنصرون,الزمر
39,55,واتبعوا أحسن ما أنزل إليكم من ربكم من قبل أن يأتيكم العذاب بغتة وأنتم لا تشعرون,الزمر
39,56,أن تقول نفس يا حسرتا على ما فرطت في جنب الله وإن كنت لمن الساخرين,الزمر
39,57,أو تقول لو أن الله هداني لكنت من المتقين,الزمر
39,58,أو تقول حين ترى العذاب لو أن لي كرة فأكون من المحسنين,الزمر
39,59,بلى قد جاءتك آياتي فكذبت بها واستكبرت وكنت من الكافرين,الزمر
39,60,ويوم القيامة ترى الذين كذبوا على الله وجوههم مسودة ۚ أليس في جهنم مثوى للمتكبرين,الزمر
39,61,وينجي الله الذين اتقوا بمفازتهم لا يمسهم السوء ولا هم يحزنون,الزمر
39,62,الله خالق كل شيء ۖ وهو على كل شيء وكيل,الزمر
39,63,له مقاليد السماوات والأرض ۗ والذين كفروا بآيات الله أولئك هم الخاسرون,الزمر
39,64,قل أفغير الله تأمروني أعبد أيها الجاهلون,الزمر
39,65,ولقد أوحي إليك وإلى الذين من قبلك لئن أشركت ليحبطن عملك ولتكونن من الخاسرين,الزمر
39,66,بل الله فاعبد وكن من الشاكرين,الزمر
39,67,وما قدروا الله حق قدره والأرض جميعا قبضته يوم القيامة والسماوات مطويات بيمينه ۚ سبحانه وتعالى عما يشركون,الزمر
39,68,ونفخ في الصور فصعق من في السماوات ومن في الأرض إلا من شاء الله ۖ ثم نفخ فيه أخرى فإذا هم قيام ينظرون,الزمر
39,69,وأشرقت الأرض بنور ربها ووضع الكتاب وجيء بالنبيين والشهداء وقضي بينهم بالحق وهم لا يظلمون,الزمر
39,70,ووفيت كل نفس ما عملت وهو أعلم بما يفعلون,الزمر
39,71,وسيق الذين كفروا إلى جهنم زمرا ۖ حتى إذا جاءوها فتحت أبوابها وقال لهم خزنتها ألم يأتكم رسل منكم يتلون عليكم آيات ربكم وينذرونكم لقاء يومكم هذا ۚ قالوا بلى ولكن حقت كلمة العذاب على الكافرين,الزمر
39,72,قيل ادخلوا أبواب جهنم خالدين فيها ۖ فبئس مثوى المتكبرين,الزمر
39,73,وسيق الذين اتقوا ربهم إلى الجنة زمرا ۖ حتى إذا جاءوها وفتحت أبوابها وقال لهم خزنتها سلام عليكم طبتم فادخلوها خالدين,الزمر
39,74,وقالوا الحمد لله الذي صدقنا وعده وأورثنا الأرض نتبوأ من الجنة حيث نشاء ۖ فنعم أجر العاملين,الزمر
39,75,وترى الملائكة حافين من حول العرش يسبحون بحمد ربهم ۖ وقضي بينهم بالحق وقيل الحمد لله رب العالمين,الزمر
40,1,حم,غافر
40,2,تنزيل الكتاب من الله العزيز العليم,غافر
40,3,غافر الذنب وقابل التوب شديد العقاب ذي الطول ۖ لا إله إلا هو ۖ إليه المصير,غافر
40,4,ما يجادل في آيات الله إلا الذين كفروا فلا يغررك تقلبهم في البلاد,غافر
40,5,كذبت قبلهم قوم نوح والأحزاب من بعدهم ۖ وهمت كل أمة برسولهم ليأخذوه ۖ وجادلوا بالباطل ليدحضوا به الحق فأخذتهم ۖ فكيف كان عقاب,غافر
40,6,وكذلك حقت كلمت ربك على الذين كفروا أنهم أصحاب النار,غافر
40,7,الذين يحملون العرش ومن حوله يسبحون بحمد ربهم ويؤمنون به ويستغفرون للذين آمنوا ربنا وسعت كل شيء رحمة وعلما فاغفر للذين تابوا واتبعوا سبيلك وقهم عذاب الجحيم,غافر
40,8,ربنا وأدخلهم جنات عدن التي وعدتهم ومن صلح من آبائهم وأزواجهم وذرياتهم ۚ إنك أنت العزيز الحكيم,غافر
40,9,وقهم السيئات ۚ ومن تق السيئات يومئذ فقد رحمته ۚ وذلك هو الفوز العظيم,غافر
40,10,إن الذين كفروا ينادون لمقت الله أكبر من مقتكم أنفسكم إذ تدعون إلى الإيمان فتكفرون,غافر
40,11,قالوا ربنا أمتنا اثنتين وأحييتنا اثنتين فاعترفنا بذنوبنا فهل إلى خروج من سبيل,غافر
40,12,ذلكم بأنه إذا دعي الله وحده كفرتم ۖ وإن يشرك به تؤمنوا ۚ فالحكم لله العلي الكبير,غافر
40,13,هو الذي يريكم آياته وينزل لكم من السماء رزقا ۚ وما يتذكر إلا من ينيب,غافر
40,14,فادعوا الله مخلصين له الدين ولو كره الكافرون,غافر
40,15,رفيع الدرجات ذو العرش يلقي الروح من أمره على من يشاء من عباده لينذر يوم التلاق,غافر
40,16,يوم هم بارزون ۖ لا يخفى على الله منهم شيء ۚ لمن الملك اليوم ۖ لله الواحد القهار,غافر
40,17,اليوم تجزى كل نفس بما كسبت ۚ لا ظلم اليوم ۚ إن الله سريع الحساب,غافر
40,18,وأنذرهم يوم الآزفة إذ القلوب لدى الحناجر كاظمين ۚ ما للظالمين من حميم ولا شفيع يطاع,غافر
40,19,يعلم خائنة الأعين وما تخفي الصدور,غافر
40,20,والله يقضي بالحق ۖ والذين يدعون من دونه لا يقضون بشيء ۗ إن الله هو السميع البصير,غافر
40,21,أولم يسيروا في الأرض فينظروا كيف كان عاقبة الذين كانوا من قبلهم ۚ كانوا هم أشد منهم قوة وآثارا في الأرض فأخذهم الله بذنوبهم وما كان لهم من الله من واق,غافر
40,22,ذلك بأنهم كانت تأتيهم رسلهم بالبينات فكفروا فأخذهم الله ۚ إنه قوي شديد العقاب,غافر
40,23,ولقد أرسلنا موسى بآياتنا وسلطان مبين,غافر
40,24,إلى فرعون وهامان وقارون فقالوا ساحر كذاب,غافر
40,25,فلما جاءهم بالحق من عندنا قالوا اقتلوا أبناء الذين آمنوا معه واستحيوا نساءهم ۚ وما كيد الكافرين إلا في ضلال,غافر
40,26,وقال فرعون ذروني أقتل موسى وليدع ربه ۖ إني أخاف أن يبدل دينكم أو أن يظهر في الأرض الفساد,غافر
40,27,وقال موسى إني عذت بربي وربكم من كل متكبر لا يؤمن بيوم الحساب,غافر
40,28,وقال رجل مؤمن من آل فرعون يكتم إيمانه أتقتلون رجلا أن يقول ربي الله وقد جاءكم بالبينات من ربكم ۖ وإن يك كاذبا فعليه كذبه ۖ وإن يك صادقا يصبكم بعض الذي يعدكم ۖ إن الله لا يهدي من هو مسرف كذاب,غافر
40,29,يا قوم لكم الملك اليوم ظاهرين في الأرض فمن ينصرنا من بأس الله إن جاءنا ۚ قال فرعون ما أريكم إلا ما أرى وما أهديكم إلا سبيل الرشاد,غافر
40,30,وقال الذي آمن يا قوم إني أخاف عليكم مثل يوم الأحزاب,غافر
40,31,مثل دأب قوم نوح وعاد وثمود والذين من بعدهم ۚ وما الله يريد ظلما للعباد,غافر
40,32,ويا قوم إني أخاف عليكم يوم التناد,غافر
40,33,يوم تولون مدبرين ما لكم من الله من عاصم ۗ ومن يضلل الله فما له من هاد,غافر
40,34,ولقد جاءكم يوسف من قبل بالبينات فما زلتم في شك مما جاءكم به ۖ حتى إذا هلك قلتم لن يبعث الله من بعده رسولا ۚ كذلك يضل الله من هو مسرف مرتاب,غافر
40,35,الذين يجادلون في آيات الله بغير سلطان أتاهم ۖ كبر مقتا عند الله وعند الذين آمنوا ۚ كذلك يطبع الله على كل قلب متكبر جبار,غافر
40,36,وقال فرعون يا هامان ابن لي صرحا لعلي أبلغ الأسباب,غافر
40,37,أسباب السماوات فأطلع إلى إله موسى وإني لأظنه كاذبا ۚ وكذلك زين لفرعون سوء عمله وصد عن السبيل ۚ وما كيد فرعون إلا في تباب,غافر
40,38,وقال الذي آمن يا قوم اتبعون أهدكم سبيل الرشاد,غافر
40,39,يا قوم إنما هذه الحياة الدنيا متاع وإن الآخرة هي دار القرار,غافر
40,40,من عمل سيئة فلا يجزى إلا مثلها ۖ ومن عمل صالحا من ذكر أو أنثى وهو مؤمن فأولئك يدخلون الجنة يرزقون فيها بغير حساب,غافر
40,41,ويا قوم ما لي أدعوكم إلى النجاة وتدعونني إلى النار,غافر
40,42,تدعونني لأكفر بالله وأشرك به ما ليس لي به علم وأنا أدعوكم إلى العزيز الغفار,غافر
40,43,لا جرم أنما تدعونني إليه ليس له دعوة في الدنيا ولا في الآخرة وأن مردنا إلى الله وأن المسرفين هم أصحاب النار,غافر
40,44,فستذكرون ما أقول لكم ۚ وأفوض أمري إلى الله ۚ إن الله بصير بالعباد,غافر
40,45,فوقاه الله سيئات ما مكروا ۖ وحاق بآل فرعون سوء العذاب,غافر
40,46,النار يعرضون عليها غدوا وعشيا ۖ ويوم تقوم الساعة أدخلوا آل فرعون أشد العذاب,غافر
40,47,وإذ يتحاجون في النار فيقول الضعفاء للذين استكبروا إنا كنا لكم تبعا فهل أنتم مغنون عنا نصيبا من النار,غافر
40,48,قال الذين استكبروا إنا كل فيها إن الله قد حكم بين العباد,غافر
40,49,وقال الذين في النار لخزنة جهنم ادعوا ربكم يخفف عنا يوما من العذاب,غافر
40,50,قالوا أولم تك تأتيكم رسلكم بالبينات ۖ قالوا بلى ۚ قالوا فادعوا ۗ وما دعاء الكافرين إلا في ضلال,غافر
40,51,إنا لننصر رسلنا والذين آمنوا في الحياة الدنيا ويوم يقوم الأشهاد,غافر
40,52,يوم لا ينفع الظالمين معذرتهم ۖ ولهم اللعنة ولهم سوء الدار,غافر
40,53,ولقد آتينا موسى الهدى وأورثنا بني إسرائيل الكتاب,غافر
40,54,هدى وذكرى لأولي الألباب,غافر
40,55,فاصبر إن وعد الله حق واستغفر لذنبك وسبح بحمد ربك بالعشي والإبكار,غافر
40,56,إن الذين يجادلون في آيات الله بغير سلطان أتاهم ۙ إن في صدورهم إلا كبر ما هم ببالغيه ۚ فاستعذ بالله ۖ إنه هو السميع البصير,غافر
40,57,لخلق السماوات والأرض أكبر من خلق الناس ولكن أكثر الناس لا يعلمون,غافر
40,58,وما يستوي الأعمى والبصير والذين آمنوا وعملوا الصالحات ولا المسيء ۚ قليلا ما تتذكرون,غافر
40,59,إن الساعة لآتية لا ريب فيها ولكن أكثر الناس لا يؤمنون,غافر
40,60,وقال ربكم ادعوني أستجب لكم ۚ إن الذين يستكبرون عن عبادتي سيدخلون جهنم داخرين,غافر
40,61,الله الذي جعل لكم الليل لتسكنوا فيه والنهار مبصرا ۚ إن الله لذو فضل على الناس ولكن أكثر الناس لا يشكرون,غافر
40,62,ذلكم الله ربكم خالق كل شيء لا إله إلا هو ۖ فأنى تؤفكون,غافر
40,63,كذلك يؤفك الذين كانوا بآيات الله يجحدون,غافر
40,64,الله الذي جعل لكم الأرض قرارا والسماء بناء وصوركم فأحسن صوركم ورزقكم من الطيبات ۚ ذلكم الله ربكم ۖ فتبارك الله رب العالمين,غافر
40,65,هو الحي لا إله إلا هو فادعوه مخلصين له الدين ۗ الحمد لله رب العالمين,غافر
40,66,قل إني نهيت أن أعبد الذين تدعون من دون الله لما جاءني البينات من ربي وأمرت أن أسلم لرب العالمين,غافر
40,67,هو الذي خلقكم من تراب ثم من نطفة ثم من علقة ثم يخرجكم طفلا ثم لتبلغوا أشدكم ثم لتكونوا شيوخا ۚ ومنكم من يتوفى من قبل ۖ ولتبلغوا أجلا مسمى ولعلكم تعقلون,غافر
40,68,هو الذي يحيي ويميت ۖ فإذا قضى أمرا فإنما يقول له كن فيكون,غافر
40,69,ألم تر إلى الذين يجادلون في آيات الله أنى يصرفون,غافر
40,70,الذين كذبوا بالكتاب وبما أرسلنا به رسلنا ۖ فسوف يعلمون,غافر
40,71,إذ الأغلال في أعناقهم والسلاسل يسحبون,غافر
40,72,في الحميم ثم في النار يسجرون,غافر
40,73,ثم قيل لهم أين ما كنتم تشركون,غافر
40,74,من دون الله ۖ قالوا ضلوا عنا بل لم نكن ندعو من قبل شيئا ۚ كذلك يضل الله الكافرين,غافر
40,75,ذلكم بما كنتم تفرحون في الأرض بغير الحق وبما كنتم تمرحون,غافر
40,76,ادخلوا أبواب جهنم خالدين فيها ۖ فبئس مثوى المتكبرين,غافر
40,77,فاصبر إن وعد الله حق ۚ فإما نرينك بعض الذي نعدهم أو نتوفينك فإلينا يرجعون,غافر
40,78,ولقد أرسلنا رسلا من قبلك منهم من قصصنا عليك ومنهم من لم نقصص عليك ۗ وما كان لرسول أن يأتي بآية إلا بإذن الله ۚ فإذا جاء أمر الله قضي بالحق وخسر هنالك المبطلون,غافر
40,79,الله الذي جعل لكم الأنعام لتركبوا منها ومنها تأكلون,غافر
40,80,ولكم فيها منافع ولتبلغوا عليها حاجة في صدوركم وعليها وعلى الفلك تحملون,غافر
40,81,ويريكم آياته فأي آيات الله تنكرون,غافر
40,82,أفلم يسيروا في الأرض فينظروا كيف كان عاقبة الذين من قبلهم ۚ كانوا أكثر منهم وأشد قوة وآثارا في الأرض فما أغنى عنهم ما كانوا يكسبون,غافر
40,83,فلما جاءتهم رسلهم بالبينات فرحوا بما عندهم من العلم وحاق بهم ما كانوا به يستهزئون,غافر
40,84,فلما رأوا بأسنا قالوا آمنا بالله وحده وكفرنا بما كنا به مشركين,غافر
40,85,فلم يك ينفعهم إيمانهم لما رأوا بأسنا ۖ سنت الله التي قد خلت في عباده ۖ وخسر هنالك الكافرون,غافر
41,1,حم,فصلت
