num_soura,num_aya,aya,name_soura
1,1,بسم الله الرحمن الرحيم,الفاتحة
1,2,الحمد لله رب العالمين,الفاتحة
1,3,الرحمن الرحيم,الفاتحة
1,4,مالك يوم الدين,الفاتحة
1,5,إياك نعبد وإياك نستعين,الفاتحة
1,6,اهدنا الصراط المستقيم,الفاتحة
1,7,صراط الذين أنعمت عليهم غير المغضوب عليهم ولا الضالين,الفاتحة
2,1,الم,البقرة
2,2,ذلك الكتاب لا ريب ۛ فيه ۛ هدى للمتقين,البقرة
2,3,الذين يؤمنون بالغيب ويقيمون الصلاة ومما رزقناهم ينفقون,البقرة
2,4,والذين يؤمنون بما أنزل إليك وما أنزل من قبلك وبالآخرة هم يوقنون,البقرة
2,5,أولئك على هدى من ربهم ۖ وأولئك هم المفلحون,البقرة
2,6,إن الذين كفروا سواء عليهم أأنذرتهم أم لم تنذرهم لا يؤمنون,البقرة
2,7,ختم الله على قلوبهم وعلى سمعهم ۖ وعلى أبصارهم غشاوة ۖ ولهم عذاب عظيم,البقرة
2,8,ومن الناس من يقول آمنا بالله وباليوم الآخر وما هم بمؤمنين,البقرة
2,9,يخادعون الله والذين آمنوا وما يخدعون إلا أنفسهم وما يشعرون,البقرة
2,10,في قلوبهم مرض فزادهم الله مرضا ۖ ولهم عذاب أليم بما كانوا يكذبون,البقرة
2,11,وإذا قيل لهم لا تفسدوا في الأرض قالوا إنما نحن مصلحون,البقرة
2,12,ألا إنهم هم المفسدون ولكن لا يشعرون,البقرة
2,13,وإذا قيل لهم آمنوا كما آمن الناس قالوا أنؤمن كما آمن السفهاء ۗ ألا إنهم هم السفهاء ولكن لا يعلمون,البقرة
2,14,وإذا لقوا الذين آمنوا قالوا آمنا وإذا خلوا إلى شياطينهم قالوا إنا معكم إنما نحن مستهزئون,البقرة
2,15,الله يستهزئ بهم ويمدهم في طغيانهم يعمهون,البقرة
2,16,أولئك الذين اشتروا الضلالة بالهدى فما ربحت تجارتهم وما كانوا مهتدين,البقرة
2,17,مثلهم كمثل الذي استوقد نارا فلما أضاءت ما حوله ذهب الله بنورهم وتركهم في ظلمات لا يبصرون,البقرة
2,18,صم بكم عمي فهم لا يرجعون,البقرة
2,19,أو كصيب من السماء فيه ظلمات ورعد وبرق يجعلون أصابعهم في آذانهم من الصواعق حذر الموت ۚ والله محيط بالكافرين,البقرة
2,20,يكاد البرق يخطف أبصارهم ۖ كلما أضاء لهم مشوا فيه وإذا أظلم عليهم قاموا ۚ ولو شاء الله لذهب بسمعهم وأبصارهم ۚ إن الله على كل شيء قدير,البقرة
2,21,يا أيها الناس اعبدوا ربكم الذي خلقكم والذين من قبلكم لعلكم تتقون,البقرة
2,22,الذي جعل لكم الأرض فراشا والسماء بناء وأنزل من السماء ماء فأخرج به من الثمرات رزقا لكم ۖ فلا تجعلوا لله أندادا وأنتم تعلمون,البقرة
2,23,وإن كنتم في ريب مما نزلنا على عبدنا فأتوا بسورة من مثله وادعوا شهداءكم من دون الله إن كنتم صادقين,البقرة
2,24,فإن لم تفعلوا ولن تفعلوا فاتقوا النار التي وقودها الناس والحجارة ۖ أعدت للكافرين,البقرة
2,25,وبشر الذين آمنوا وعملوا الصالحات أن لهم جنات تجري من تحتها الأنهار ۖ كلما رزقوا منها من ثمرة رزقا ۙ قالوا هذا الذي رزقنا من قبل ۖ وأتوا به متشابها ۖ ولهم فيها أزواج مطهرة ۖ وهم فيها خالدون,البقرة
2,26,إن الله لا يستحيي أن يضرب مثلا ما بعوضة فما فوقها ۚ فأما الذين آمنوا فيعلمون أنه الحق من ربهم ۖ وأما الذين كفروا فيقولون ماذا أراد الله بهذا مثلا ۘ يضل به كثيرا ويهدي به كثيرا ۚ وما يضل به إلا الفاسقين,البقرة
2,27,الذين ينقضون عهد الله من بعد ميثاقه ويقطعون ما أمر الله به أن يوصل ويفسدون في الأرض ۚ أولئك هم الخاسرون,البقرة
2,28,كيف تكفرون بالله وكنتم أمواتا فأحياكم ۖ ثم يميتكم ثم يحييكم ثم إليه ترجعون,البقرة
2,29,هو الذي خلق لكم ما في الأرض جميعا ثم استوى إلى السماء فسواهن سبع سماوات ۚ وهو بكل شيء عليم,البقرة
2,30,وإذ قال ربك للملائكة إني جاعل في الأرض خليفة ۖ قالوا أتجعل فيها من يفسد فيها ويسفك الدماء ونحن نسبح بحمدك ونقدس لك ۖ قال إني أعلم ما لا تعلمون,البقرة
2,31,وعلم آدم الأسماء كلها ثم عرضهم على الملائكة فقال أنبئوني بأسماء هؤلاء إن كنتم صادقين,البقرة
2,32,قالوا سبحانك لا علم لنا إلا ما علمتنا ۖ إنك أنت العليم الحكيم,البقرة
2,33,قال يا آدم أنبئهم بأسمائهم ۖ فلما أنبأهم بأسمائهم قال ألم أقل لكم إني أعلم غيب السماوات والأرض وأعلم ما تبدون وما كنتم تكتمون,البقرة
2,34,وإذ قلنا للملائكة اسجدوا لآدم فسجدوا إلا إبليس أبى واستكبر وكان من الكافرين,البقرة
2,35,وقلنا يا آدم اسكن أنت وزوجك الجنة وكلا منها رغدا حيث شئتما ولا تقربا هذه الشجرة فتكونا من الظالمين,البقرة
2,36,فأزلهما الشيطان عنها فأخرجهما مما كانا فيه ۖ وقلنا اهبطوا بعضكم لبعض عدو ۖ ولكم في الأرض مستقر ومتاع إلى حين,البقرة
2,37,فتلقى آدم من ربه كلمات فتاب عليه ۚ إنه هو التواب الرحيم,البقرة
2,38,قلنا اهبطوا منها جميعا ۖ فإما يأتينكم مني هدى فمن تبع هداي فلا خوف عليهم ولا هم يحزنون,البقرة
2,39,والذين كفروا وكذبوا بآياتنا أولئك أصحاب النار ۖ هم فيها خالدون,البقرة
2,40,يا بني إسرائيل اذكروا نعمتي التي أنعمت عليكم وأوفوا بعهدي أوف بعهدكم وإياي فارهبون,البقرة
2,41,وآمنوا بما أنزلت مصدقا لما معكم ولا تكونوا أول كافر به ۖ ولا تشتروا بآياتي ثمنا قليلا وإياي فاتقون,البقرة
2,42,ولا تلبسوا الحق بالباطل وتكتموا الحق وأنتم تعلمون,البقرة
2,43,وأقيموا الصلاة وآتوا الزكاة واركعوا مع الراكعين,البقرة
2,44,أتأمرون الناس بالبر وتنسون أنفسكم وأنتم تتلون الكتاب ۚ أفلا تعقلون,البقرة
2,45,واستعينوا بالصبر والصلاة ۚ وإنها لكبيرة إلا على الخاشعين,البقرة
2,46,الذين يظنون أنهم ملاقو ربهم وأنهم إليه راجعون,البقرة
2,47,يا بني إسرائيل اذكروا نعمتي التي أنعمت عليكم وأني فضلتكم على العالمين,البقرة
2,48,واتقوا يوما لا تجزي نفس عن نفس شيئا ولا يقبل منها شفاعة ولا يؤخذ منها عدل ولا هم ينصرون,البقرة
2,49,وإذ نجيناكم من آل فرعون يسومونكم سوء العذاب يذبحون أبناءكم ويستحيون نساءكم ۚ وفي ذلكم بلاء من ربكم عظيم,البقرة
2,50,وإذ فرقنا بكم البحر فأنجيناكم وأغرقنا آل فرعون وأنتم تنظرون,البقرة
2,51,وإذ واعدنا موسى أربعين ليلة ثم اتخذتم العجل من بعده وأنتم ظالمون,البقرة
2,52,ثم عفونا عنكم من بعد ذلك لعلكم تشكرون,البقرة
2,53,وإذ آتينا موسى الكتاب والفرقان لعلكم تهتدون,البقرة
2,54,وإذ قال موسى لقومه يا قوم إنكم ظلمتم أنفسكم باتخاذكم العجل فتوبوا إلى بارئكم فاقتلوا أنفسكم ذلكم خير لكم عند بارئكم فتاب عليكم ۚ إنه هو التواب الرحيم,البقرة
2,55,وإذ قلتم يا موسى لن نؤمن لك حتى نرى الله جهرة فأخذتكم الصاعقة وأنتم تنظرون,البقرة
2,56,ثم بعثناكم من بعد موتكم لعلكم تشكرون,البقرة
2,57,وظللنا عليكم الغمام وأنزلنا عليكم المن والسلوى ۖ كلوا من طيبات ما رزقناكم ۖ وما ظلمونا ولكن كانوا أنفسهم يظلمون,البقرة
2,58,وإذ قلنا ادخلوا هذه القرية فكلوا منها حيث شئتم رغدا وادخلوا الباب سجدا وقولوا حطة نغفر لكم خطاياكم ۚ وسنزيد المحسنين,البقرة
2,59,فبدل الذين ظلموا قولا غير الذي قيل لهم فأنزلنا على الذين ظلموا رجزا من السماء بما كانوا يفسقون,البقرة
2,60,وإذ استسقى موسى لقومه فقلنا اضرب بعصاك الحجر ۖ فانفجرت منه اثنتا عشرة عينا ۖ قد علم كل أناس مشربهم ۖ كلوا واشربوا من رزق الله ولا تعثوا في الأرض مفسدين,البقرة
2,61,وإذ قلتم يا موسى لن نصبر على طعام واحد فادع لنا ربك يخرج لنا مما تنبت الأرض من بقلها وقثائها وفومها وعدسها وبصلها ۖ قال أتستبدلون الذي هو أدنى بالذي هو خير ۚ اهبطوا مصرا فإن لكم ما سألتم ۗ وضربت عليهم الذلة والمسكنة وباءوا بغضب من الله ۗ ذلك بأنهم كانوا يكفرون بآيات الله ويقتلون النبيين بغير الحق ۗ ذلك بما عصوا وكانوا يعتدون,البقرة
2,62,إن الذين آمنوا والذين هادوا والنصارى والصابئين من آمن بالله واليوم الآخر وعمل صالحا فلهم أجرهم عند ربهم ولا خوف عليهم ولا هم يحزنون,البقرة
2,63,وإذ أخذنا ميثاقكم ورفعنا فوقكم الطور خذوا ما آتيناكم بقوة واذكروا ما فيه لعلكم تتقون,البقرة
2,64,ثم توليتم من بعد ذلك ۖ فلولا فضل الله عليكم ورحمته لكنتم من الخاسرين,البقرة
2,65,ولقد علمتم الذين اعتدوا منكم في السبت فقلنا لهم كونوا قردة خاسئين,البقرة
2,66,فجعلناها نكالا لما بين يديها وما خلفها وموعظة للمتقين,البقرة
2,67,وإذ قال موسى لقومه إن الله يأمركم أن تذبحوا بقرة ۖ قالوا أتتخذنا هزوا ۖ قال أعوذ بالله أن أكون من الجاهلين,البقرة
2,68,قالوا ادع لنا ربك يبين لنا ما هي ۚ قال إنه يقول إنها بقرة لا فارض ولا بكر عوان بين ذلك ۖ فافعلوا ما تؤمرون,البقرة
2,69,قالوا ادع لنا ربك يبين لنا ما لونها ۚ قال إنه يقول إنها بقرة صفراء فاقع لونها تسر الناظرين,البقرة
2,70,قالوا ادع لنا ربك يبين لنا ما هي إن البقر تشابه علينا وإنا إن شاء الله لمهتدون,البقرة
2,71,قال إنه يقول إنها بقرة لا ذلول تثير الأرض ولا تسقي الحرث مسلمة لا شية فيها ۚ قالوا الآن جئت بالحق ۚ فذبحوها وما كادوا يفعلون,البقرة
2,72,وإذ قتلتم نفسا فادارأتم فيها ۖ والله مخرج ما كنتم تكتمون,البقرة
2,73,فقلنا اضربوه ببعضها ۚ كذلك يحيي الله الموتى ويريكم آياته لعلكم تعقلون,البقرة
2,74,ثم قست قلوبكم من بعد ذلك فهي كالحجارة أو أشد قسوة ۚ وإن من الحجارة لما يتفجر منه الأنهار ۚ وإن منها لما يشقق فيخرج منه الماء ۚ وإن منها لما يهبط من خشية الله ۗ وما الله بغافل عما تعملون,البقرة
2,75,أفتطمعون أن يؤمنوا لكم وقد كان فريق منهم يسمعون كلام الله ثم يحرفونه من بعد ما عقلوه وهم يعلمون,البقرة
2,76,وإذا لقوا الذين آمنوا قالوا آمنا وإذا خلا بعضهم إلى بعض قالوا أتحدثونهم بما فتح الله عليكم ليحاجوكم به عند ربكم ۚ أفلا تعقلون,البقرة
2,77,أولا يعلمون أن الله يعلم ما يسرون وما يعلنون,البقرة
2,78,ومنهم أميون لا يعلمون الكتاب إلا أماني وإن هم إلا يظنون,البقرة
2,79,فويل للذين يكتبون الكتاب بأيديهم ثم يقولون هذا من عند الله ليشتروا به ثمنا قليلا ۖ فويل لهم مما كتبت أيديهم وويل لهم مما يكسبون,البقرة
2,80,وقالوا لن تمسنا النار إلا أياما معدودة ۚ قل أتخذتم عند الله عهدا فلن يخلف الله عهده ۖ أم تقولون على الله ما لا تعلمون,البقرة
2,81,بلى من كسب سيئة وأحاطت به خطيئته فأولئك أصحاب النار ۖ هم فيها خالدون,البقرة
2,82,والذين آمنوا وعملوا الصالحات أولئك أصحاب الجنة ۖ هم فيها خالدون,البقرة
2,83,وإذ أخذنا ميثاق بني إسرائيل لا تعبدون إلا الله وبالوالدين إحسانا وذي القربى واليتامى والمساكين وقولوا للناس حسنا وأقيموا الصلاة وآتوا الزكاة ثم توليتم إلا قليلا منكم وأنتم معرضون,البقرة
2,84,وإذ أخذنا ميثاقكم لا تسفكون دماءكم ولا تخرجون أنفسكم من دياركم ثم أقررتم وأنتم تشهدون,البقرة
2,85,ثم أنتم هؤلاء تقتلون أنفسكم وتخرجون فريقا منكم من ديارهم تظاهرون عليهم بالإثم والعدوان وإن يأتوكم أسارى تفادوهم وهو محرم عليكم إخراجهم ۚ أفتؤمنون ببعض الكتاب وتكفرون ببعض ۚ فما جزاء من يفعل ذلك منكم إلا خزي في الحياة الدنيا ۖ ويوم القيامة يردون إلى أشد العذاب ۗ وما الله بغافل عما تعملون,البقرة
2,86,أولئك الذين اشتروا الحياة الدنيا بالآخرة ۖ فلا يخفف عنهم العذاب ولا هم ينصرون,البقرة
2,87,ولقد آتينا موسى الكتاب وقفينا من بعده بالرسل ۖ وآتينا عيسى ابن مريم البينات وأيدناه بروح القدس ۗ أفكلما جاءكم رسول بما لا تهوى أنفسكم استكبرتم ففريقا كذبتم وفريقا تقتلون,البقرة
2,88,وقالوا قلوبنا غلف ۚ بل لعنهم الله بكفرهم فقليلا ما يؤمنون,البقرة
2,89,ولما جاءهم كتاب من عند الله مصدق لما معهم وكانوا من قبل يستفتحون على الذين كفروا فلما جاءهم ما عرفوا كفروا به ۚ فلعنة الله على الكافرين,البقرة
2,90,بئسما اشتروا به أنفسهم أن يكفروا بما أنزل الله بغيا أن ينزل الله من فضله على من يشاء من عباده ۖ فباءوا بغضب على غضب ۚ وللكافرين عذاب مهين,البقرة
2,91,وإذا قيل لهم آمنوا بما أنزل الله قالوا نؤمن بما أنزل علينا ويكفرون بما وراءه وهو الحق مصدقا لما معهم ۗ قل فلم تقتلون أنبياء الله من قبل إن كنتم مؤمنين,البقرة
2,92,ولقد جاءكم موسى بالبينات ثم اتخذتم العجل من بعده وأنتم ظالمون,البقرة
2,93,وإذ أخذنا ميثاقكم ورفعنا فوقكم الطور خذوا ما آتيناكم بقوة واسمعوا ۖ قالوا سمعنا وعصينا وأشربوا في قلوبهم العجل بكفرهم ۚ قل بئسما يأمركم به إيمانكم إن كنتم مؤمنين,البقرة
2,94,قل إن كانت لكم الدار الآخرة عند الله خالصة من دون الناس فتمنوا الموت إن كنتم صادقين,البقرة
2,95,ولن يتمنوه أبدا بما قدمت أيديهم ۗ والله عليم بالظالمين,البقرة
2,96,ولتجدنهم أحرص الناس على حياة ومن الذين أشركوا ۚ يود أحدهم لو يعمر ألف سنة وما هو بمزحزحه من العذاب أن يعمر ۗ والله بصير بما يعملون,البقرة
2,97,قل من كان عدوا لجبريل فإنه نزله على قلبك بإذن الله مصدقا لما بين يديه وهدى وبشرى للمؤمنين,البقرة
2,98,من كان عدوا لله وملائكته ورسله وجبريل وميكال فإن الله عدو للكافرين,البقرة
2,99,ولقد أنزلنا إليك آيات بينات ۖ وما يكفر بها إلا الفاسقون,البقرة
2,100,أوكلما عاهدوا عهدا نبذه فريق منهم ۚ بل أكثرهم لا يؤمنون,البقرة
2,101,ولما جاءهم رسول من عند الله مصدق لما معهم نبذ فريق من الذين أوتوا الكتاب كتاب الله وراء ظهورهم كأنهم لا يعلمون,البقرة
2,102,واتبعوا ما تتلو الشياطين على ملك سليمان ۖ وما كفر سليمان ولكن الشياطين كفروا يعلمون الناس السحر وما أنزل على الملكين ببابل هاروت وماروت ۚ وما يعلمان من أحد حتى يقولا إنما نحن فتنة فلا تكفر ۖ فيتعلمون منهما ما يفرقون به بين المرء وزوجه ۚ وما هم بضارين به من أحد إلا بإذن الله ۚ ويتعلمون ما يضرهم ولا ينفعهم ۚ ولقد علموا لمن اشتراه ما له في الآخرة من خلاق ۚ ولبئس ما شروا به أنفسهم ۚ لو كانوا يعلمون,البقرة
2,103,ولو أنهم آمنوا واتقوا لمثوبة من عند الله خير ۖ لو كانوا يعلمون,البقرة
2,104,يا أيها الذين آمنوا لا تقولوا راعنا وقولوا انظرنا واسمعوا ۗ وللكافرين عذاب أليم,البقرة
2,105,ما يود الذين كفروا من أهل الكتاب ولا المشركين أن ينزل عليكم من خير من ربكم ۗ والله يختص برحمته من يشاء ۚ والله ذو الفضل العظيم,البقرة
2,106,ما ننسخ من آية أو ننسها نأت بخير منها أو مثلها ۗ ألم تعلم أن الله على كل شيء قدير,البقرة
2,107,ألم تعلم أن الله له ملك السماوات والأرض ۗ وما لكم من دون الله من ولي ولا نصير,البقرة
2,108,أم تريدون أن تسألوا رسولكم كما سئل موسى من قبل ۗ ومن يتبدل الكفر بالإيمان فقد ضل سواء السبيل,البقرة
2,109,ود كثير من أهل الكتاب لو يردونكم من بعد إيمانكم كفارا حسدا من عند أنفسهم من بعد ما تبين لهم الحق ۖ فاعفوا واصفحوا حتى يأتي الله بأمره ۗ إن الله على كل شيء قدير,البقرة
2,110,وأقيموا الصلاة وآتوا الزكاة ۚ وما تقدموا لأنفسكم من خير تجدوه عند الله ۗ إن الله بما تعملون بصير,البقرة
2,111,وقالوا لن يدخل الجنة إلا من كان هودا أو نصارى ۗ تلك أمانيهم ۗ قل هاتوا برهانكم إن كنتم صادقين,البقرة
2,112,بلى من أسلم وجهه لله وهو محسن فله أجره عند ربه ولا خوف عليهم ولا هم يحزنون,البقرة
2,113,وقالت اليهود ليست النصارى على شيء وقالت النصارى ليست اليهود على شيء وهم يتلون الكتاب ۗ كذلك قال الذين لا يعلمون مثل قولهم ۚ فالله يحكم بينهم يوم القيامة فيما كانوا فيه يختلفون,البقرة
2,114,ومن أظلم ممن منع مساجد الله أن يذكر فيها اسمه وسعى في خرابها ۚ أولئك ما كان لهم أن يدخلوها إلا خائفين ۚ لهم في الدنيا خزي ولهم في الآخرة عذاب عظيم,البقرة
2,115,ولله المشرق والمغرب ۚ فأينما تولوا فثم وجه الله ۚ إن الله واسع عليم,البقرة
2,116,وقالوا اتخذ الله ولدا ۗ سبحانه ۖ بل له ما في السماوات والأرض ۖ كل له قانتون,البقرة
2,117,بديع السماوات والأرض ۖ وإذا قضى أمرا فإنما يقول له كن فيكون,البقرة
2,118,وقال الذين لا يعلمون لولا يكلمنا الله أو تأتينا آية ۗ كذلك قال الذين من قبلهم مثل قولهم ۘ تشابهت قلوبهم ۗ قد بينا الآيات لقوم يوقنون,البقرة
2,119,إنا أرسلناك بالحق بشيرا ونذيرا ۖ ولا تسأل عن أصحاب الجحيم,البقرة
2,120,ولن ترضى عنك اليهود ولا النصارى حتى تتبع ملتهم ۗ قل إن هدى الله هو الهدى ۗ ولئن اتبعت أهواءهم بعد الذي جاءك من العلم ۙ ما لك من الله من ولي ولا نصير,البقرة
2,121,الذين آتيناهم الكتاب يتلونه حق تلاوته أولئك يؤمنون به ۗ ومن يكفر به فأولئك هم الخاسرون,البقرة
2,122,يا بني إسرائيل اذكروا نعمتي التي أنعمت عليكم وأني فضلتكم على العالمين,البقرة
2,123,واتقوا يوما لا تجزي نفس عن نفس شيئا ولا يقبل منها عدل ولا تنفعها شفاعة ولا هم ينصرون,البقرة
2,124,وإذ ابتلى إبراهيم ربه بكلمات فأتمهن ۖ قال إني جاعلك للناس إماما ۖ قال ومن ذريتي ۖ قال لا ينال عهدي الظالمين,البقرة
2,125,وإذ جعلنا البيت مثابة للناس وأمنا واتخذوا من مقام إبراهيم مصلى ۖ وعهدنا إلى إبراهيم وإسماعيل أن طهرا بيتي للطائفين والعاكفين والركع السجود,البقرة
2,126,وإذ قال إبراهيم رب اجعل هذا بلدا آمنا وارزق أهله من الثمرات من آمن منهم بالله واليوم الآخر ۖ قال ومن كفر فأمتعه قليلا ثم أضطره إلى عذاب النار ۖ وبئس المصير,البقرة
2,127,وإذ يرفع إبراهيم القواعد من البيت وإسماعيل ربنا تقبل منا ۖ إنك أنت السميع العليم,البقرة
2,128,ربنا واجعلنا مسلمين لك ومن ذريتنا أمة مسلمة لك وأرنا مناسكنا وتب علينا ۖ إنك أنت التواب الرحيم,البقرة
2,129,ربنا وابعث فيهم رسولا منهم يتلو عليهم آياتك ويعلمهم الكتاب والحكمة ويزكيهم ۚ إنك أنت العزيز الحكيم,البقرة
2,130,ومن يرغب عن ملة إبراهيم إلا من سفه نفسه ۚ ولقد اصطفيناه في الدنيا ۖ وإنه في الآخرة لمن الصالحين,البقرة
2,131,إذ قال له ربه أسلم ۖ قال أسلمت لرب العالمين,البقرة
2,132,ووصى بها إبراهيم بنيه ويعقوب يا بني إن الله اصطفى لكم الدين فلا تموتن إلا وأنتم مسلمون,البقرة
2,133,أم كنتم شهداء إذ حضر يعقوب الموت إذ قال لبنيه ما تعبدون من بعدي قالوا نعبد إلهك وإله آبائك إبراهيم وإسماعيل وإسحاق إلها واحدا ونحن له مسلمون,البقرة
