num_soura,num_aya,aya,name_soura
6,163,لا شريك له ۖ وبذلك أمرت وأنا أول المسلمين,الأنعام
6,164,قل أغير الله أبغي ربا وهو رب كل شيء ۚ ولا تكسب كل نفس إلا عليها ۚ ولا تزر وازرة وزر أخرى ۚ ثم إلى ربكم مرجعكم فينبئكم بما كنتم فيه تختلفون,الأنعام
6,165,وهو الذي جعلكم خلائف الأرض ورفع بعضكم فوق بعض درجات ليبلوكم في ما آتاكم ۗ إن ربك سريع العقاب وإنه لغفور رحيم,الأنعام
7,1,المص,الأعراف
7,2,كتاب أنزل إليك فلا يكن في صدرك حرج منه لتنذر به وذكرى للمؤمنين,الأعراف
7,3,اتبعوا ما أنزل إليكم من ربكم ولا تتبعوا من دونه أولياء ۗ قليلا ما تذكرون,الأعراف
7,4,وكم من قرية أهلكناها فجاءها بأسنا بياتا أو هم قائلون,الأعراف
7,5,فما كان دعواهم إذ جاءهم بأسنا إلا أن قالوا إنا كنا ظالمين,الأعراف
7,6,فلنسألن الذين أرسل إليهم ولنسألن المرسلين,الأعراف
7,7,فلنقصن عليهم بعلم ۖ وما كنا غائبين,الأعراف
7,8,والوزن يومئذ الحق ۚ فمن ثقلت موازينه فأولئك هم المفلحون,الأعراف
7,9,ومن خفت موازينه فأولئك الذين خسروا أنفسهم بما كانوا بآياتنا يظلمون,الأعراف
7,10,ولقد مكناكم في الأرض وجعلنا لكم فيها معايش ۗ قليلا ما تشكرون,الأعراف
7,11,ولقد خلقناكم ثم صورناكم ثم قلنا للملائكة اسجدوا لآدم فسجدوا إلا إبليس لم يكن من الساجدين,الأعراف
7,12,قال ما منعك ألا تسجد إذ أمرتك ۖ قال أنا خير منه خلقتني من نار وخلقته من طين,الأعراف
7,13,قال فاهبط منها فما يكون لك أن تتكبر فيها فاخرج إنك من الصاغرين,الأعراف
7,14,قال أنظرني إلى يوم يبعثون,الأعراف
7,15,قال إنك من المنظرين,الأعراف
7,16,قال فبما أغويتني لأقعدن لهم صراطك المستقيم,الأعراف
7,17,ثم لآتينهم من بين أيديهم ومن خلفهم وعن أيمانهم وعن شمائلهم ۖ ولا تجد أكثرهم شاكرين,الأعراف
7,18,قال اخرج منها مذءوما مدحورا ۖ لمن تبعك منهم لأملأن جهنم منكم أجمعين,الأعراف
7,19,ويا آدم اسكن أنت وزوجك الجنة فكلا من حيث شئتما ولا تقربا هذه الشجرة فتكونا من الظالمين,الأعراف
7,20,فوسوس لهما الشيطان ليبدي لهما ما ووري عنهما من سوآتهما وقال ما نهاكما ربكما عن هذه الشجرة إلا أن تكونا ملكين أو تكونا من الخالدين,الأعراف
7,21,وقاسمهما إني لكما لمن الناصحين,الأعراف
7,22,فدلاهما بغرور ۚ فلما ذاقا الشجرة بدت لهما سوآتهما وطفقا يخصفان عليهما من ورق الجنة ۖ وناداهما ربهما ألم أنهكما عن تلكما الشجرة وأقل لكما إن الشيطان لكما عدو مبين,الأعراف
7,23,قالا ربنا ظلمنا أنفسنا وإن لم تغفر لنا وترحمنا لنكونن من الخاسرين,الأعراف
7,24,قال اهبطوا بعضكم لبعض عدو ۖ ولكم في الأرض مستقر ومتاع إلى حين,الأعراف
7,25,قال فيها تحيون وفيها تموتون ومنها تخرجون,الأعراف
7,26,يا بني آدم قد أنزلنا عليكم لباسا يواري سوآتكم وريشا ۖ ولباس التقوى ذلك خير ۚ ذلك من آيات الله لعلهم يذكرون,الأعراف
7,27,يا بني آدم لا يفتننكم الشيطان كما أخرج أبويكم من الجنة ينزع عنهما لباسهما ليريهما سوآتهما ۗ إنه يراكم هو وقبيله من حيث لا ترونهم ۗ إنا جعلنا الشياطين أولياء للذين لا يؤمنون,الأعراف
7,28,وإذا فعلوا فاحشة قالوا وجدنا عليها آباءنا والله أمرنا بها ۗ قل إن الله لا يأمر بالفحشاء ۖ أتقولون على الله ما لا تعلمون,الأعراف
7,29,قل أمر ربي بالقسط ۖ وأقيموا وجوهكم عند كل مسجد وادعوه مخلصين له الدين ۚ كما بدأكم تعودون,الأعراف
7,30,فريقا هدى وفريقا حق عليهم الضلالة ۗ إنهم اتخذوا الشياطين أولياء من دون الله ويحسبون أنهم مهتدون,الأعراف
7,31,يا بني آدم خذوا زينتكم عند كل مسجد وكلوا واشربوا ولا تسرفوا ۚ إنه لا يحب المسرفين,الأعراف
7,32,قل من حرم زينة الله التي أخرج لعباده والطيبات من الرزق ۚ قل هي للذين آمنوا في الحياة الدنيا خالصة يوم القيامة ۗ كذلك نفصل الآيات لقوم يعلمون,الأعراف
7,33,قل إنما حرم ربي الفواحش ما ظهر منها وما بطن والإثم والبغي بغير الحق وأن تشركوا بالله ما لم ينزل به سلطانا وأن تقولوا على الله ما لا تعلمون,الأعراف
7,34,ولكل أمة أجل ۖ فإذا جاء أجلهم لا يستأخرون ساعة ۖ ولا يستقدمون,الأعراف
7,35,يا بني آدم إما يأتينكم رسل منكم يقصون عليكم آياتي ۙ فمن اتقى وأصلح فلا خوف عليهم ولا هم يحزنون,الأعراف
7,36,والذين كذبوا بآياتنا واستكبروا عنها أولئك أصحاب النار ۖ هم فيها خالدون,الأعراف
7,37,فمن أظلم ممن افترى على الله كذبا أو كذب بآياته ۚ أولئك ينالهم نصيبهم من الكتاب ۖ حتى إذا جاءتهم رسلنا يتوفونهم قالوا أين ما كنتم تدعون من دون الله ۖ قالوا ضلوا عنا وشهدوا على أنفسهم أنهم كانوا كافرين,الأعراف
7,38,قال ادخلوا في أمم قد خلت من قبلكم من الجن والإنس في النار ۖ كلما دخلت أمة لعنت أختها ۖ حتى إذا اداركوا فيها جميعا قالت أخراهم لأولاهم ربنا هؤلاء أضلونا فآتهم عذابا ضعفا من النار ۖ قال لكل ضعف ولكن لا تعلمون,الأعراف
7,39,وقالت أولاهم لأخراهم فما كان لكم علينا من فضل فذوقوا العذاب بما كنتم تكسبون,الأعراف
7,40,إن الذين كذبوا بآياتنا واستكبروا عنها لا تفتح لهم أبواب السماء ولا يدخلون الجنة حتى يلج الجمل في سم الخياط ۚ وكذلك نجزي المجرمين,الأعراف
7,41,لهم من جهنم مهاد ومن فوقهم غواش ۚ وكذلك نجزي الظالمين,الأعراف
7,42,والذين آمنوا وعملوا الصالحات لا نكلف نفسا إلا وسعها أولئك أصحاب الجنة ۖ هم فيها خالدون,الأعراف
7,43,ونزعنا ما في صدورهم من غل تجري من تحتهم الأنهار ۖ وقالوا الحمد لله الذي هدانا لهذا وما كنا لنهتدي لولا أن هدانا الله ۖ لقد جاءت رسل ربنا بالحق ۖ ونودوا أن تلكم الجنة أورثتموها بما كنتم تعملون,الأعراف
7,44,ونادى أصحاب الجنة أصحاب النار أن قد وجدنا ما وعدنا ربنا حقا فهل وجدتم ما وعد ربكم حقا ۖ قالوا نعم ۚ فأذن مؤذن بينهم أن لعنة الله على الظالمين,الأعراف
7,45,الذين يصدون عن سبيل الله ويبغونها عوجا وهم بالآخرة كافرون,الأعراف
7,46,وبينهما حجاب ۚ وعلى الأعراف رجال يعرفون كلا بسيماهم ۚ ونادوا أصحاب الجنة أن سلام عليكم ۚ لم يدخلوها وهم يطمعون,الأعراف
7,47,وإذا صرفت أبصارهم تلقاء أصحاب النار قالوا ربنا لا تجعلنا مع القوم الظالمين,الأعراف
7,48,ونادى أصحاب الأعراف رجالا يعرفونهم بسيماهم قالوا ما أغنى عنكم جمعكم وما كنتم تستكبرون,الأعراف
7,49,أهؤلاء الذين أقسمتم لا ينالهم الله برحمة ۚ ادخلوا الجنة لا خوف عليكم ولا أنتم تحزنون,الأعراف
7,50,ونادى أصحاب النار أصحاب الجنة أن أفيضوا علينا من الماء أو مما رزقكم الله ۚ قالوا إن الله حرمهما على الكافرين,الأعراف
7,51,الذين اتخذوا دينهم لهوا ولعبا وغرتهم الحياة الدنيا ۚ فاليوم ننساهم كما نسوا لقاء يومهم هذا وما كانوا بآياتنا يجحدون,الأعراف
7,52,ولقد جئناهم بكتاب فصلناه على علم هدى ورحمة لقوم يؤمنون,الأعراف
7,53,هل ينظرون إلا تأويله ۚ يوم يأتي تأويله يقول الذين نسوه من قبل قد جاءت رسل ربنا بالحق فهل لنا من شفعاء فيشفعوا لنا أو نرد فنعمل غير الذي كنا نعمل ۚ قد خسروا أنفسهم وضل عنهم ما كانوا يفترون,الأعراف
7,54,إن ربكم الله الذي خلق السماوات والأرض في ستة أيام ثم استوى على العرش يغشي الليل النهار يطلبه حثيثا والشمس والقمر والنجوم مسخرات بأمره ۗ ألا له الخلق والأمر ۗ تبارك الله رب العالمين,الأعراف
7,55,ادعوا ربكم تضرعا وخفية ۚ إنه لا يحب المعتدين,الأعراف
7,56,ولا تفسدوا في الأرض بعد إصلاحها وادعوه خوفا وطمعا ۚ إن رحمت الله قريب من المحسنين,الأعراف
7,57,وهو الذي يرسل الرياح بشرا بين يدي رحمته ۖ حتى إذا أقلت سحابا ثقالا سقناه لبلد ميت فأنزلنا به الماء فأخرجنا به من كل الثمرات ۚ كذلك نخرج الموتى لعلكم تذكرون,الأعراف
7,58,والبلد الطيب يخرج نباته بإذن ربه ۖ والذي خبث لا يخرج إلا نكدا ۚ كذلك نصرف الآيات لقوم يشكرون,الأعراف
7,59,لقد أرسلنا نوحا إلى قومه فقال يا قوم اعبدوا الله ما لكم من إله غيره إني أخاف عليكم عذاب يوم عظيم,الأعراف
7,60,قال الملأ من قومه إنا لنراك في ضلال مبين,الأعراف
7,61,قال يا قوم ليس بي ضلالة ولكني رسول من رب العالمين,الأعراف
7,62,أبلغكم رسالات ربي وأنصح لكم وأعلم من الله ما لا تعلمون,الأعراف
7,63,أوعجبتم أن جاءكم ذكر من ربكم على رجل منكم لينذركم ولتتقوا ولعلكم ترحمون,الأعراف
7,64,فكذبوه فأنجيناه والذين معه في الفلك وأغرقنا الذين كذبوا بآياتنا ۚ إنهم كانوا قوما عمين,الأعراف
7,65,وإلى عاد أخاهم هودا ۗ قال يا قوم اعبدوا الله ما لكم من إله غيره ۚ أفلا تتقون,الأعراف
7,66,قال الملأ الذين كفروا من قومه إنا لنراك في سفاهة وإنا لنظنك من الكاذبين,الأعراف
7,67,قال يا قوم ليس بي سفاهة ولكني رسول من رب العالمين,الأعراف
7,68,أبلغكم رسالات ربي وأنا لكم ناصح أمين,الأعراف
7,69,أوعجبتم أن جاءكم ذكر من ربكم على رجل منكم لينذركم ۚ واذكروا إذ جعلكم خلفاء من بعد قوم نوح وزادكم في الخلق بسطة ۖ فاذكروا آلاء الله لعلكم تفلحون,الأعراف
7,70,قالوا أجئتنا لنعبد الله وحده ونذر ما كان يعبد آباؤنا ۖ فأتنا بما تعدنا إن كنت من الصادقين,الأعراف
7,71,قال قد وقع عليكم من ربكم رجس وغضب ۖ أتجادلونني في أسماء سميتموها أنتم وآباؤكم ما نزل الله بها من سلطان ۚ فانتظروا إني معكم من المنتظرين,الأعراف
7,72,فأنجيناه والذين معه برحمة منا وقطعنا دابر الذين كذبوا بآياتنا ۖ وما كانوا مؤمنين,الأعراف
7,73,وإلى ثمود أخاهم صالحا ۗ قال يا قوم اعبدوا الله ما لكم من إله غيره ۖ قد جاءتكم بينة من ربكم ۖ هذه ناقة الله لكم آية ۖ فذروها تأكل في أرض الله ۖ ولا تمسوها بسوء فيأخذكم عذاب أليم,الأعراف
7,74,واذكروا إذ جعلكم خلفاء من بعد عاد وبوأكم في الأرض تتخذون من سهولها قصورا وتنحتون الجبال بيوتا ۖ فاذكروا آلاء الله ولا تعثوا في الأرض مفسدين,الأعراف
7,75,قال الملأ الذين استكبروا من قومه للذين استضعفوا لمن آمن منهم أتعلمون أن صالحا مرسل من ربه ۚ قالوا إنا بما أرسل به مؤمنون,الأعراف
7,76,قال الذين استكبروا إنا بالذي آمنتم به كافرون,الأعراف
7,77,فعقروا الناقة وعتوا عن أمر ربهم وقالوا يا صالح ائتنا بما تعدنا إن كنت من المرسلين,الأعراف
7,78,فأخذتهم الرجفة فأصبحوا في دارهم جاثمين,الأعراف
7,79,فتولى عنهم وقال يا قوم لقد أبلغتكم رسالة ربي ونصحت لكم ولكن لا تحبون الناصحين,الأعراف
7,80,ولوطا إذ قال لقومه أتأتون الفاحشة ما سبقكم بها من أحد من العالمين,الأعراف
7,81,إنكم لتأتون الرجال شهوة من دون النساء ۚ بل أنتم قوم مسرفون,الأعراف
7,82,وما كان جواب قومه إلا أن قالوا أخرجوهم من قريتكم ۖ إنهم أناس يتطهرون,الأعراف
7,83,فأنجيناه وأهله إلا امرأته كانت من الغابرين,الأعراف
7,84,وأمطرنا عليهم مطرا ۖ فانظر كيف كان عاقبة المجرمين,الأعراف
7,85,وإلى مدين أخاهم شعيبا ۗ قال يا قوم اعبدوا الله ما لكم من إله غيره ۖ قد جاءتكم بينة من ربكم ۖ فأوفوا الكيل والميزان ولا تبخسوا الناس أشياءهم ولا تفسدوا في الأرض بعد إصلاحها ۚ ذلكم خير لكم إن كنتم مؤمنين,الأعراف
7,86,ولا تقعدوا بكل صراط توعدون وتصدون عن سبيل الله من آمن به وتبغونها عوجا ۚ واذكروا إذ كنتم قليلا فكثركم ۖ وانظروا كيف كان عاقبة المفسدين,الأعراف
7,87,وإن كان طائفة منكم آمنوا بالذي أرسلت به وطائفة لم يؤمنوا فاصبروا حتى يحكم الله بيننا ۚ وهو خير الحاكمين,الأعراف
7,88,قال الملأ الذين استكبروا من قومه لنخرجنك يا شعيب والذين آمنوا معك من قريتنا أو لتعودن في ملتنا ۚ قال أولو كنا كارهين,الأعراف
7,89,قد افترينا على الله كذبا إن عدنا في ملتكم بعد إذ نجانا الله منها ۚ وما يكون لنا أن نعود فيها إلا أن يشاء الله ربنا ۚ وسع ربنا كل شيء علما ۚ على الله توكلنا ۚ ربنا افتح بيننا وبين قومنا بالحق وأنت خير الفاتحين,الأعراف
7,90,وقال الملأ الذين كفروا من قومه لئن اتبعتم شعيبا إنكم إذا لخاسرون,الأعراف
7,91,فأخذتهم الرجفة فأصبحوا في دارهم جاثمين,الأعراف
7,92,الذين كذبوا شعيبا كأن لم يغنوا فيها ۚ الذين كذبوا شعيبا كانوا هم الخاسرين,الأعراف
7,93,فتولى عنهم وقال يا قوم لقد أبلغتكم رسالات ربي ونصحت لكم ۖ فكيف آسى على قوم كافرين,الأعراف
7,94,وما أرسلنا في قرية من نبي إلا أخذنا أهلها بالبأساء والضراء لعلهم يضرعون,الأعراف
7,95,ثم بدلنا مكان السيئة الحسنة حتى عفوا وقالوا قد مس آباءنا الضراء والسراء فأخذناهم بغتة وهم لا يشعرون,الأعراف
7,96,ولو أن أهل القرى آمنوا واتقوا لفتحنا عليهم بركات من السماء والأرض ولكن كذبوا فأخذناهم بما كانوا يكسبون,الأعراف
7,97,أفأمن أهل القرى أن يأتيهم بأسنا بياتا وهم نائمون,الأعراف
7,98,أوأمن أهل القرى أن يأتيهم بأسنا ضحى وهم يلعبون,الأعراف
7,99,أفأمنوا مكر الله ۚ فلا يأمن مكر الله إلا القوم الخاسرون,الأعراف
7,100,أولم يهد للذين يرثون الأرض من بعد أهلها أن لو نشاء أصبناهم بذنوبهم ۚ ونطبع على قلوبهم فهم لا يسمعون,الأعراف
7,101,تلك القرى نقص عليك من أنبائها ۚ ولقد جاءتهم رسلهم بالبينات فما كانوا ليؤمنوا بما كذبوا من قبل ۚ كذلك يطبع الله على قلوب الكافرين,الأعراف
7,102,وما وجدنا لأكثرهم من عهد ۖ وإن وجدنا أكثرهم لفاسقين,الأعراف
7,103,ثم بعثنا من بعدهم موسى بآياتنا إلى فرعون وملئه فظلموا بها ۖ فانظر كيف كان عاقبة المفسدين,الأعراف
7,104,وقال موسى يا فرعون إني رسول من رب العالمين,الأعراف
7,105,حقيق على أن لا أقول على الله إلا الحق ۚ قد جئتكم ببينة من ربكم فأرسل معي بني إسرائيل,الأعراف
7,106,قال إن كنت جئت بآية فأت بها إن كنت من الصادقين,الأعراف
7,107,فألقى عصاه فإذا هي ثعبان مبين,الأعراف
7,108,ونزع يده فإذا هي بيضاء للناظرين,الأعراف
7,109,قال الملأ من قوم فرعون إن هذا لساحر عليم,الأعراف
7,110,يريد أن يخرجكم من أرضكم ۖ فماذا تأمرون,الأعراف
7,111,قالوا أرجه وأخاه وأرسل في المدائن حاشرين,الأعراف
7,112,يأتوك بكل ساحر عليم,الأعراف
7,113,وجاء السحرة فرعون قالوا إن لنا لأجرا إن كنا نحن الغالبين,الأعراف
7,114,قال نعم وإنكم لمن المقربين,الأعراف
7,115,قالوا يا موسى إما أن تلقي وإما أن نكون نحن الملقين,الأعراف
7,116,قال ألقوا ۖ فلما ألقوا سحروا أعين الناس واسترهبوهم وجاءوا بسحر عظيم,الأعراف
7,117,وأوحينا إلى موسى أن ألق عصاك ۖ فإذا هي تلقف ما يأفكون,الأعراف
7,118,فوقع الحق وبطل ما كانوا يعملون,الأعراف
7,119,فغلبوا هنالك وانقلبوا صاغرين,الأعراف
7,120,وألقي السحرة ساجدين,الأعراف
7,121,قالوا آمنا برب العالمين,الأعراف
7,122,رب موسى وهارون,الأعراف
7,123,قال فرعون آمنتم به قبل أن آذن لكم ۖ إن هذا لمكر مكرتموه في المدينة لتخرجوا منها أهلها ۖ فسوف تعلمون,الأعراف
7,124,لأقطعن أيديكم وأرجلكم من خلاف ثم لأصلبنكم أجمعين,الأعراف
7,125,قالوا إنا إلى ربنا منقلبون,الأعراف
7,126,وما تنقم منا إلا أن آمنا بآيات ربنا لما جاءتنا ۚ ربنا أفرغ علينا صبرا وتوفنا مسلمين,الأعراف
7,127,وقال الملأ من قوم فرعون أتذر موسى وقومه ليفسدوا في الأرض ويذرك وآلهتك ۚ قال سنقتل أبناءهم ونستحيي نساءهم وإنا فوقهم قاهرون,الأعراف
7,128,قال موسى لقومه استعينوا بالله واصبروا ۖ إن الأرض لله يورثها من يشاء من عباده ۖ والعاقبة للمتقين,الأعراف
7,129,قالوا أوذينا من قبل أن تأتينا ومن بعد ما جئتنا ۚ قال عسى ربكم أن يهلك عدوكم ويستخلفكم في الأرض فينظر كيف تعملون,الأعراف
7,130,ولقد أخذنا آل فرعون بالسنين ونقص من الثمرات لعلهم يذكرون,الأعراف
7,131,فإذا جاءتهم الحسنة قالوا لنا هذه ۖ وإن تصبهم سيئة يطيروا بموسى ومن معه ۗ ألا إنما طائرهم عند الله ولكن أكثرهم لا يعلمون,الأعراف
7,132,وقالوا مهما تأتنا به من آية لتسحرنا بها فما نحن لك بمؤمنين,الأعراف
7,133,فأرسلنا عليهم الطوفان والجراد والقمل والضفادع والدم آيات مفصلات فاستكبروا وكانوا قوما مجرمين,الأعراف
7,134,ولما وقع عليهم الرجز قالوا يا موسى ادع لنا ربك بما عهد عندك ۖ لئن كشفت عنا الرجز لنؤمنن لك ولنرسلن معك بني إسرائيل,الأعراف
7,135,فلما كشفنا عنهم الرجز إلى أجل هم بالغوه إذا هم ينكثون,الأعراف
7,136,فانتقمنا منهم فأغرقناهم في اليم بأنهم كذبوا بآياتنا وكانوا عنها غافلين,الأعراف
7,137,وأورثنا القوم الذين كانوا يستضعفون مشارق الأرض ومغاربها التي باركنا فيها ۖ وتمت كلمت ربك الحسنى على بني إسرائيل بما صبروا ۖ ودمرنا ما كان يصنع فرعون وقومه وما كانوا يعرشون,الأعراف
7,138,وجاوزنا ببني إسرائيل البحر فأتوا على قوم يعكفون على أصنام لهم ۚ قالوا يا موسى اجعل لنا إلها كما لهم آلهة ۚ قال إنكم قوم تجهلون,الأعراف
7,139,إن هؤلاء متبر ما هم فيه وباطل ما كانوا يعملون,الأعراف
7,140,قال أغير الله أبغيكم إلها وهو فضلكم على العالمين,الأعراف
7,141,وإذ أنجيناكم من آل فرعون يسومونكم سوء العذاب ۖ يقتلون أبناءكم ويستحيون نساءكم ۚ وفي ذلكم بلاء من ربكم عظيم,الأعراف
7,142,وواعدنا موسى ثلاثين ليلة وأتممناها بعشر فتم ميقات ربه أربعين ليلة ۚ وقال موسى لأخيه هارون اخلفني في قومي وأصلح ولا تتبع سبيل المفسدين,الأعراف
7,143,ولما جاء موسى لميقاتنا وكلمه ربه قال رب أرني أنظر إليك ۚ قال لن تراني ولكن انظر إلى الجبل فإن استقر مكانه فسوف تراني ۚ فلما تجلى ربه للجبل جعله دكا وخر موسى صعقا ۚ فلما أفاق قال سبحانك تبت إليك وأنا أول المؤمنين,الأعراف
7,144,قال يا موسى إني اصطفيتك على الناس برسالاتي وبكلامي فخذ ما آتيتك وكن من الشاكرين,الأعراف
7,145,وكتبنا له في الألواح من كل شيء موعظة وتفصيلا لكل شيء فخذها بقوة وأمر قومك يأخذوا بأحسنها ۚ سأريكم دار الفاسقين,الأعراف
7,146,سأصرف عن آياتي الذين يتكبرون في الأرض بغير الحق وإن يروا كل آية لا يؤمنوا بها وإن يروا سبيل الرشد لا يتخذوه سبيلا وإن يروا سبيل الغي يتخذوه سبيلا ۚ ذلك بأنهم كذبوا بآياتنا وكانوا عنها غافلين,الأعراف
7,147,والذين كذبوا بآياتنا ولقاء الآخرة حبطت أعمالهم ۚ هل يجزون إلا ما كانوا يعملون,الأعراف
